{"$schema":"https://json-schema.org/draft/2020-12/schema","$id":"consumer-contract-v2","type":"object","additionalProperties":false,"required":["schemaVersion","consumerId","version","authorityManifestDigest","projectorVersion","families","contractDigest"],"properties":{"schemaVersion":{"const":"consumer-contract-v2"},"consumerId":{"enum":["screen","print_pdf"]},"version":{"type":"string"},"authorityManifestDigest":{"type":"string"},"projectorVersion":{"const":"canonical-projector-v1"},"families":{"type":"array"},"contractDigest":{"type":"string"}}}
