{"authorityManifestDigest":"sha256:d959d81cf29aebc7a43f4f02fc2d490e16bc41dc911afd1289e601ab20072472","consumerId":"screen","contractDigest":"sha256:6e4999968fe0972c4b0501005cfd6470e73d667aa1250b427af7fed4e129e0cf","families":[{"canonical":true,"digest":"sha256:2db4cd3f770dd382997cddd5042bf1f2da07033f1efd148e54ee232c684b4317","familyContractId":"listening","version":"1"},{"canonical":true,"digest":"sha256:e122072fbbd4d13a37a5ed604922f9c597b0873c6b30070d0b60bd2e2660063b","familyContractId":"reading","version":"3"},{"canonical":true,"digest":"sha256:851f3e4507b7b7821cda7f5eea11e7193aabcf168dfdd57531583ebd3697080e","familyContractId":"seven-choices","version":"1"},{"canonical":true,"digest":"sha256:c961b221dbb0d2f9cd57d4eeabfe01680f5144a93e3989dc8628583f3ed1c5b8","familyContractId":"cloze","version":"1"},{"canonical":true,"digest":"sha256:8284b7d7467f4064b83ec9460905f7b209801aab0aabd7220b53304b461f3e5b","familyContractId":"grammar-fill","version":"3"},{"canonical":true,"digest":"sha256:3aec2732c2b89b13cde20d262fdc039d55c58ffbe36fc8175e67ea1bdd6f9e91","familyContractId":"application-writing","version":"5"},{"canonical":true,"digest":"sha256:6282f66e24f30c32900d580b9e8d147758a71d1b6b9e3e15e7de5ba72f3e52ab","familyContractId":"continuation-writing","version":"5"}],"projectorVersion":"canonical-projector-v1","schemaVersion":"consumer-contract-v2","version":"49"}
