{"authorityManifestDigest":"sha256:9f1d0f912ff47efdbf95302841a6e357ad8ae301062204d886c2e75c0de256dc","consumerId":"print_pdf","contractDigest":"sha256:7c2218606adc48081bd2bee08eb57fce3d7692b987c461c4ea6a7c374327969a","families":[{"canonical":true,"digest":"sha256:2db4cd3f770dd382997cddd5042bf1f2da07033f1efd148e54ee232c684b4317","familyContractId":"listening","version":"1"},{"canonical":true,"digest":"sha256:91e081821b3242278c7316a811473873aa5453baadb1b9ca8ae5798d38045449","familyContractId":"reading","version":"2"},{"canonical":true,"digest":"sha256:851f3e4507b7b7821cda7f5eea11e7193aabcf168dfdd57531583ebd3697080e","familyContractId":"seven-choices","version":"1"},{"canonical":true,"digest":"sha256:c961b221dbb0d2f9cd57d4eeabfe01680f5144a93e3989dc8628583f3ed1c5b8","familyContractId":"cloze","version":"1"},{"canonical":true,"digest":"sha256:8284b7d7467f4064b83ec9460905f7b209801aab0aabd7220b53304b461f3e5b","familyContractId":"grammar-fill","version":"3"},{"canonical":true,"digest":"sha256:768808d2b1a4f2c7d4a2c01af3bafbbc302ff34174767d9870c0312e96d55958","familyContractId":"application-writing","version":"3"},{"canonical":true,"digest":"sha256:6282f66e24f30c32900d580b9e8d147758a71d1b6b9e3e15e7de5ba72f3e52ab","familyContractId":"continuation-writing","version":"5"}],"projectorVersion":"canonical-projector-v1","schemaVersion":"consumer-contract-v2","version":"42"}
