{
  "authorityManifestDigest": "sha256:f3baaaf25894fc89444a603085dfe9a274dabf4384e3e18896a4de9e6ce9d90a",
  "consumerId": "screen",
  "contractDigest": "sha256:f66df311fa881382780a0a8972037c2a2e42f209108c2070c88efe2ed83df89c",
  "families": [
    {
      "canonical": true,
      "digest": "sha256:4b4837721e3025531ca0df8f98c73c80fa39cdd24918b632956ea6bf1dc18b67",
      "familyContractId": "reading",
      "legacyCapability": "available",
      "version": "1"
    },
    {
      "canonical": true,
      "digest": "sha256:851f3e4507b7b7821cda7f5eea11e7193aabcf168dfdd57531583ebd3697080e",
      "familyContractId": "seven-choices",
      "legacyCapability": "available",
      "version": "1"
    },
    {
      "canonical": true,
      "digest": "sha256:c961b221dbb0d2f9cd57d4eeabfe01680f5144a93e3989dc8628583f3ed1c5b8",
      "familyContractId": "cloze",
      "legacyCapability": "available",
      "version": "1"
    },
    {
      "canonical": true,
      "digest": "sha256:8284b7d7467f4064b83ec9460905f7b209801aab0aabd7220b53304b461f3e5b",
      "familyContractId": "grammar-fill",
      "legacyCapability": "available",
      "version": "3"
    },
    {
      "canonical": true,
      "digest": "sha256:768808d2b1a4f2c7d4a2c01af3bafbbc302ff34174767d9870c0312e96d55958",
      "familyContractId": "application-writing",
      "legacyCapability": "available",
      "version": "3"
    },
    {
      "canonical": true,
      "digest": "sha256:213a03b131b984b2ed6136e5ccb06094bb0b446342f89d86333a4416e1f1d524",
      "familyContractId": "continuation-writing",
      "legacyCapability": "available",
      "version": "3"
    }
  ],
  "projectorVersion": "canonical-projector-v1",
  "schemaVersion": "consumer-contract-v2",
  "version": "31"
}
