{"authorityManifestDigest":"sha256:9d336fc9bbaaf83c8f68a573c707abd589b6bbf775d91587075ce0a06470221c","consumerId":"print_pdf","contractDigest":"sha256:23c82cef4a301d381642d2d0cd3b41485d3bb0108268bc007e1db94f26793b92","families":[{"canonical":true,"digest":"sha256:4b4837721e3025531ca0df8f98c73c80fa39cdd24918b632956ea6bf1dc18b67","familyContractId":"reading","legacyCapability":"available","version":"1"},{"canonical":true,"digest":"sha256:851f3e4507b7b7821cda7f5eea11e7193aabcf168dfdd57531583ebd3697080e","familyContractId":"seven-choices","legacyCapability":"available","version":"1"},{"canonical":true,"digest":"sha256:c961b221dbb0d2f9cd57d4eeabfe01680f5144a93e3989dc8628583f3ed1c5b8","familyContractId":"cloze","legacyCapability":"available","version":"1"},{"canonical":true,"digest":"sha256:8284b7d7467f4064b83ec9460905f7b209801aab0aabd7220b53304b461f3e5b","familyContractId":"grammar-fill","legacyCapability":"available","version":"3"},{"canonical":true,"digest":"sha256:768808d2b1a4f2c7d4a2c01af3bafbbc302ff34174767d9870c0312e96d55958","familyContractId":"application-writing","legacyCapability":"available","version":"3"},{"canonical":true,"digest":"sha256:c1c106dde3baf32111dfd99c11d9f732bbba9dcc38edc7b51b8b1e97cd1d1502","familyContractId":"continuation-writing","legacyCapability":"available","version":"2"}],"projectorVersion":"canonical-projector-v1","schemaVersion":"consumer-contract-v2","version":"29"}
