{"authorityManifestDigest":"sha256:f5cc5987192ab498cf7c5b3a77e8b9b0c8bd2cbb1ab712897e4e14fb771ae75c","consumerId":"print_pdf","contractDigest":"sha256:47a9672e16c40e7c1e1f997f398daf8b87feb03cba3faa20ef9b459df5e5ce97","families":[{"canonical":true,"digest":"sha256:4b4837721e3025531ca0df8f98c73c80fa39cdd24918b632956ea6bf1dc18b67","familyContractId":"reading","legacyCapability":"available","version":"1"},{"canonical":true,"digest":"sha256:851f3e4507b7b7821cda7f5eea11e7193aabcf168dfdd57531583ebd3697080e","familyContractId":"seven-choices","legacyCapability":"available","version":"1"},{"canonical":true,"digest":"sha256:c961b221dbb0d2f9cd57d4eeabfe01680f5144a93e3989dc8628583f3ed1c5b8","familyContractId":"cloze","legacyCapability":"available","version":"1"},{"canonical":true,"digest":"sha256:98c5c64b69a6d3e822f085feb73ef5036ba6912787519e92be78fc67498ef3d8","familyContractId":"grammar-fill","legacyCapability":"available","version":"1"},{"canonical":true,"digest":"sha256:768808d2b1a4f2c7d4a2c01af3bafbbc302ff34174767d9870c0312e96d55958","familyContractId":"application-writing","legacyCapability":"available","version":"3"},{"canonical":true,"digest":"sha256:c1c106dde3baf32111dfd99c11d9f732bbba9dcc38edc7b51b8b1e97cd1d1502","familyContractId":"continuation-writing","legacyCapability":"available","version":"2"}],"projectorVersion":"canonical-projector-v1","schemaVersion":"consumer-contract-v2","version":"24"}
