{"authorityManifestDigest":"sha256:01be8530c65a86e9aff5a7170d1f17ad0b88e64637fb1db05e948adb0b9716dd","consumerId":"print_pdf","contractDigest":"sha256:f91071794e8e1c250c3c22272a301d951eb42062f90e4b48e7be9336bb65e00d","families":[{"canonical":true,"digest":"sha256:4b4837721e3025531ca0df8f98c73c80fa39cdd24918b632956ea6bf1dc18b67","familyContractId":"reading","legacyCapability":"available","version":"1"},{"canonical":true,"digest":"sha256:851f3e4507b7b7821cda7f5eea11e7193aabcf168dfdd57531583ebd3697080e","familyContractId":"seven-choices","legacyCapability":"available","version":"1"},{"canonical":true,"digest":"sha256:c961b221dbb0d2f9cd57d4eeabfe01680f5144a93e3989dc8628583f3ed1c5b8","familyContractId":"cloze","legacyCapability":"available","version":"1"},{"canonical":true,"digest":"sha256:53e37a67b4de555485608b3a4a677a845da3f42410bfe9f69721c788256f2324","familyContractId":"grammar-fill","legacyCapability":"available","version":"2"},{"canonical":true,"digest":"sha256:768808d2b1a4f2c7d4a2c01af3bafbbc302ff34174767d9870c0312e96d55958","familyContractId":"application-writing","legacyCapability":"available","version":"3"},{"canonical":true,"digest":"sha256:c1c106dde3baf32111dfd99c11d9f732bbba9dcc38edc7b51b8b1e97cd1d1502","familyContractId":"continuation-writing","legacyCapability":"available","version":"2"}],"projectorVersion":"canonical-projector-v1","schemaVersion":"consumer-contract-v2","version":"25"}
